{
  "id": "mg-007",
  "width": 5,
  "height": 5,
  "grid": [
    [
      2,
      2,
      0,
      0,
      0
    ],
    [
      2,
      2,
      0,
      0,
      0
    ],
    [
      0,
      0,
      0,
      0,
      0
    ],
    [
      0,
      0,
      1,
      0,
      0
    ],
    [
      0,
      0,
      0,
      0,
      0
    ]
  ],
  "task": {
    "targetTier": 4,
    "targetCount": 1
  },
  "difficulty": 2
}
